Title,Video ID,Statistics
Spring Boot Tutorial for Beginners (Java Framework),vtPkZShrvXQ,"{'viewCount': '1656920', 'likeCount': '24717', 'favoriteCount': '0', 'commentCount': '852'}"
jamovi for Data Analysis - Full Tutorial,mZomeS0tLxY,"{'viewCount': '124813', 'likeCount': '2075', 'favoriteCount': '0', 'commentCount': '56'}"
"Intermediate React Tutorial - Todoist Clone (with Firebase, Custom Hooks, SCSS, React Testing)",hT3j87FMR6M,"{'viewCount': '155311', 'likeCount': '3999', 'favoriteCount': '0', 'commentCount': '240'}"
Scratch Tutorial for Beginners - Make a Flappy Bird Game,x14G4DCk4nY,"{'viewCount': '356224', 'likeCount': '3965', 'favoriteCount': '0', 'commentCount': '250'}"
How to Build an E-commerce Website with Django and Python,YZvRrldjf1Y,"{'viewCount': '1214413', 'likeCount': '21027', 'favoriteCount': '0', 'commentCount': '554'}"
Docker Tutorial for Beginners - A Full DevOps Course on How to Run Applications in Containers,fqMOX6JJhGo,"{'viewCount': '2532166', 'likeCount': '43559', 'favoriteCount': '0', 'commentCount': '1119'}"
How to Build Tetris in React - GameDev Tutorial (with React Hooks!),ZGOaCxX8HIU,"{'viewCount': '156633', 'likeCount': '3446', 'favoriteCount': '0', 'commentCount': '174'}"
Learn Angular Material - Full Tutorial,jUfEn032IL8,"{'viewCount': '397069', 'likeCount': '6240', 'favoriteCount': '0', 'commentCount': '161'}"
Python NumPy Tutorial for Beginners,QUT1VHiLmmI,"{'viewCount': '1229679', 'likeCount': '30377', 'favoriteCount': '0', 'commentCount': '452'}"
Kotlin Programming Fundamentals Tutorial - Full Course,AeC4G-H-MQA,"{'viewCount': '101290', 'likeCount': '2711', 'favoriteCount': '0', 'commentCount': '99'}"
In-Depth React Tutorial: Build a Hotel Reservation Site (with Contentful and Netlify),LXJOvkVYQqA,"{'viewCount': '333703', 'likeCount': '7803', 'favoriteCount': '0', 'commentCount': '246'}"
Full Ethical Hacking Course - Network Penetration Testing for Beginners (2019),3Kq1MIfTWCE,"{'viewCount': '6465972', 'likeCount': '207884', 'favoriteCount': '0', 'commentCount': '5404'}"
Svelte Tutorial - Is it better than React?,vhGiGqZ78Rs,"{'viewCount': '50812', 'likeCount': '1137', 'favoriteCount': '0', 'commentCount': '95'}"
Dart Programming Tutorial - Full Course,Ej_Pcr4uC2Q,"{'viewCount': '763474', 'likeCount': '14489', 'favoriteCount': '0', 'commentCount': '603'}"
Godot Game Engine Tutorial - Make a 2D Platformer Game,fQXKjmCDkIA,"{'viewCount': '68792', 'likeCount': '1221', 'favoriteCount': '0', 'commentCount': '72'}"
"Solidity Tutorial - A Full Course on Ethereum, Blockchain Development, Smart Contracts, and the EVM",ipwxYa-F1uY,"{'viewCount': '1478848', 'likeCount': '23976', 'favoriteCount': '0', 'commentCount': '1170'}"
"React Hooks Tutorial - A Crash Course on Styled Components, JSX, React Router, and HOC",iVRO0toVdYM,"{'viewCount': '49094', 'likeCount': '1088', 'favoriteCount': '0', 'commentCount': '37'}"
Deep Reinforcement Learning in Python Tutorial - A Course on How to Implement Deep Learning Papers,GJJc1t0rtSU,"{'viewCount': '277237', 'likeCount': '4668', 'favoriteCount': '0', 'commentCount': '82'}"
Intermediate React and Firebase Tutorial - Build an Evernote Clone,I250xdtUvy8,"{'viewCount': '82896', 'likeCount': '1966', 'favoriteCount': '0', 'commentCount': '104'}"
Kotlin Course - Tutorial for Beginners,F9UC9DY-vIU,"{'viewCount': '1528551', 'likeCount': '28115', 'favoriteCount': '0', 'commentCount': '1191'}"
Learn GraphQL with Laravel and Vue.js - Full Tutorial,4z3EMCc4bP4,"{'viewCount': '57743', 'likeCount': '1268', 'favoriteCount': '0', 'commentCount': '44'}"
Getting Started with Node.js - Full Tutorial,gG3pytAY2MY,"{'viewCount': '152215', 'likeCount': '2936', 'favoriteCount': '0', 'commentCount': '68'}"
Linux for Ethical Hackers (Kali Linux Tutorial),lZAoFs75_cs,"{'viewCount': '5319030', 'likeCount': '103971', 'favoriteCount': '0', 'commentCount': '2673'}"
Flutter Course - Full Tutorial for Beginners (Build iOS and Android Apps),pTJJsmejUOQ,"{'viewCount': '878123', 'likeCount': '16494', 'favoriteCount': '0', 'commentCount': '360'}"
Data Visualization with D3.js - Full Tutorial Course,_8V5o2UHG0E,"{'viewCount': '1119232', 'likeCount': '21594', 'favoriteCount': '0', 'commentCount': '340'}"
Build Your First Blockchain App Using Ethereum Smart Contracts and Solidity,coQ5dg8wM2o,"{'viewCount': '2109585', 'likeCount': '33903', 'favoriteCount': '0', 'commentCount': '2107'}"
"Learn the MERN Stack - Full Tutorial (MongoDB, Express, React, Node.js)",7CqJlxBYj-M,"{'viewCount': '1570539', 'likeCount': '28328', 'favoriteCount': '0', 'commentCount': '1499'}"
Full Stack React & Firebase Tutorial - Build a social media app,m_u6P5k0vP0,"{'viewCount': '1038914', 'likeCount': '25379', 'favoriteCount': '0', 'commentCount': '1710'}"
Learn Go Programming - Golang Tutorial for Beginners,YS4e4q9oBaU,"{'viewCount': '2408331', 'likeCount': '43847', 'favoriteCount': '0', 'commentCount': '1424'}"
Learn Webpack - Full Tutorial for Beginners,MpGLUVbqoYQ,"{'viewCount': '357450', 'likeCount': '8968', 'favoriteCount': '0', 'commentCount': '549'}"
Run freeCodeCamp Locally  (P8D2) - Live Coding with Jesse,GFQ9VZYw2-0,"{'viewCount': '17621', 'likeCount': '302', 'favoriteCount': '0', 'commentCount': '15'}"
Penetration Testing: Gophish Tutorial (Phishing Framework),S6S5JF6Gou0,"{'viewCount': '190441', 'likeCount': '2600', 'favoriteCount': '0', 'commentCount': '144'}"
Statistics - A Full University Course on Data Science Basics,xxpc-HPKN28,"{'viewCount': '2561587', 'likeCount': '58029', 'favoriteCount': '0', 'commentCount': '926'}"
"AWS AppSync Tutorial - GraphQL APIs with AppSync, Amplify and Angular",QEMfnr5MO1w,"{'viewCount': '56045', 'likeCount': '804', 'favoriteCount': '0', 'commentCount': '31'}"
Intro to HTML & CSS - Tutorial,kLO4X_3VYdg,"{'viewCount': '72861', 'likeCount': '1473', 'favoriteCount': '0', 'commentCount': '64'}"
React Native Browser Editor  (P8D1) - Live Coding with Jesse,drN9DEm3hFE,"{'viewCount': '14238', 'likeCount': '303', 'favoriteCount': '0', 'commentCount': '29'}"
R Programming Tutorial - Learn the Basics of Statistical Computing,_V8eKsto3Ug,"{'viewCount': '3765416', 'likeCount': '61202', 'favoriteCount': '0', 'commentCount': '1669'}"
Learn Data Science Tutorial - Full Course for Beginners,ua-CiDNNj30,"{'viewCount': '3010996', 'likeCount': '66847', 'favoriteCount': '0', 'commentCount': '1020'}"
Learn Flask for Python - Full Tutorial,Z1RJmh_OqeA,"{'viewCount': '1531963', 'likeCount': '24377', 'favoriteCount': '0', 'commentCount': '1313'}"
E-Commerce JavaScript Tutorial - Shopping Cart from Scratch,023Psne_-_4,"{'viewCount': '391857', 'likeCount': '9749', 'favoriteCount': '0', 'commentCount': '396'}"
Intro to Java Programming - Course for Absolute Beginners,GoXwIVyNvX0,"{'viewCount': '2479635', 'likeCount': '40286', 'favoriteCount': '0', 'commentCount': '887'}"
Ionic Framework 4 - Full Tutorial - iOS / Android App Development,AvbuIRg8_Jg,"{'viewCount': '264953', 'likeCount': '3444', 'favoriteCount': '0', 'commentCount': '107'}"
The Great Gatsby Bootcamp - Full Gatsby.js Tutorial Course,kzWIUX3CpuI,"{'viewCount': '87294', 'likeCount': '1967', 'favoriteCount': '0', 'commentCount': '160'}"
Reinforcement Learning Course - Full Machine Learning Tutorial,ELE2_Mftqoc,"{'viewCount': '430458', 'likeCount': '7500', 'favoriteCount': '0', 'commentCount': '166'}"
Symfony PHP Framework Tutorial - Full Course,Bo0guUbL5uo,"{'viewCount': '362382', 'likeCount': '3994', 'favoriteCount': '0', 'commentCount': '266'}"
Code a magic card trick using JavaScript & Node.js - Tutorial,h21pa3yeW08,"{'viewCount': '35260', 'likeCount': '797', 'favoriteCount': '0', 'commentCount': '30'}"
Laravel PHP Framework Tutorial - Full Course for Beginners (2019),ImtZ5yENzgE,"{'viewCount': '2259436', 'likeCount': '31691', 'favoriteCount': '0', 'commentCount': '2567'}"
Python for Everybody - Full University Python Course,8DvywoWv6fI,"{'viewCount': '6367703', 'likeCount': '177030', 'favoriteCount': '0', 'commentCount': '4672'}"
React Native Web Styling Part 2  (P7D13) - Live Coding with Jesse,VSLMJ2mZx5Y,"{'viewCount': '10309', 'likeCount': '128', 'favoriteCount': '0', 'commentCount': '6'}"
Learn HTML5 and CSS3 From Scratch - Full Course,mU6anWqZJcc,"{'viewCount': '5623980', 'likeCount': '118570', 'favoriteCount': '0', 'commentCount': '4383'}"
APIs in React Tutorial - Recipe App using React Router,tvfeBLMA_Q4,"{'viewCount': '62764', 'likeCount': '1263', 'favoriteCount': '0', 'commentCount': '70'}"
React Native Web Styling  (P7D12) - Live Coding with Jesse,XHJbEbq8zKQ,"{'viewCount': '8628', 'likeCount': '175', 'favoriteCount': '0', 'commentCount': '5'}"
Django Rest Framework & React Tutorial: Learning Management System (Blackboard / Moodle Clone),JIFqqdRxmVo,"{'viewCount': '173284', 'likeCount': '2530', 'favoriteCount': '0', 'commentCount': '82'}"
Learn Regular Expressions (Regex) - Crash Course for Beginners,ZfQFUJhPqMM,"{'viewCount': '181769', 'likeCount': '5347', 'favoriteCount': '0', 'commentCount': '185'}"
React Native Web Math Game Dev  (P7D11) - Live Coding with Jesse,tp1XjVEBdws,"{'viewCount': '9533', 'likeCount': '197', 'favoriteCount': '0', 'commentCount': '4'}"
How Deep Neural Networks Work - Full Course for Beginners,dPWYUELwIdM,"{'viewCount': '1631135', 'likeCount': '16977', 'favoriteCount': '0', 'commentCount': '388'}"
MASTER your coding interview,iAHQopLuZ4Q,"{'viewCount': '114746', 'likeCount': '2676', 'favoriteCount': '0', 'commentCount': '78'}"
React Native Web Testing Part 2 (P7D10) - Live Coding with Jesse,FajtSrvwQ44,"{'viewCount': '6449', 'likeCount': '136', 'favoriteCount': '0', 'commentCount': '3'}"
Dropbox API / JavaScript ES6 Tutorial - Expense Organizer,AzCQrjWQJs4,"{'viewCount': '39179', 'likeCount': '632', 'favoriteCount': '0', 'commentCount': '25'}"
Learn PostgreSQL Tutorial - Full Course for Beginners,qw--VYLpxG4,"{'viewCount': '2149067', 'likeCount': '39634', 'favoriteCount': '0', 'commentCount': '1914'}"
React Native Web Testing (P7D9) - Live Coding with Jesse,B51jR_MfaXk,"{'viewCount': '8311', 'likeCount': '160', 'favoriteCount': '0', 'commentCount': '16'}"
ReasonML Programming - Full Course for Beginners,sjWsAYJF8BA,"{'viewCount': '34857', 'likeCount': '792', 'favoriteCount': '0', 'commentCount': '34'}"
Develop an AI to play Connect Four - Python Tutorial,8392NJjj8s0,"{'viewCount': '93232', 'likeCount': '1130', 'favoriteCount': '0', 'commentCount': '47'}"
Python Online Multiplayer Game Development Tutorial,McoDjOCb2Zo,"{'viewCount': '332469', 'likeCount': '7507', 'favoriteCount': '0', 'commentCount': '376'}"
React Native Web Deployment (P7D8) - Live Coding with Jesse,9McfnAxz23M,"{'viewCount': '9314', 'likeCount': '170', 'favoriteCount': '0', 'commentCount': '14'}"
Create a C# Application from Start to Finish - Complete Course,wfWxdh-_k_4,"{'viewCount': '2308815', 'likeCount': '50887', 'favoriteCount': '0', 'commentCount': '1818'}"
React Native with Hooks (P7D7) - Live Coding with Jesse,2KkwRjuS30I,"{'viewCount': '8375', 'likeCount': '153', 'favoriteCount': '0', 'commentCount': '1'}"
2d Game Dev Unity Tutorial - Hyper Casual Game,kRGQJqHHwXA,"{'viewCount': '57175', 'likeCount': '1246', 'favoriteCount': '0', 'commentCount': '39'}"
React Native Web Game Styles  (P7D6) - Live Coding with Jesse,pexVpeGjoC8,"{'viewCount': '7971', 'likeCount': '153', 'favoriteCount': '0', 'commentCount': '4'}"
Learn Vue.js - Full Course for Beginners - 2019,4deVCNJq3qc,"{'viewCount': '1001622', 'likeCount': '13774', 'favoriteCount': '0', 'commentCount': '791'}"
React Native Web Game Logic Part 2  (P7D5) - Live Coding with Jesse,Cu7z-L-UQhA,"{'viewCount': '8032', 'likeCount': '160', 'favoriteCount': '0', 'commentCount': '2'}"
"React Native Web Full App Tutorial - Build a Workout App for iOS, Android, and Web",_CBYbEGvxYY,"{'viewCount': '298090', 'likeCount': '3898', 'favoriteCount': '0', 'commentCount': '114'}"
How to Make a Custom Website from Scratch using WordPress (Theme Development) - 2019 Tutorial,KibbYf9avko,"{'viewCount': '478035', 'likeCount': '9154', 'favoriteCount': '0', 'commentCount': '334'}"
React Native Web Game Logic  (P7D4) - Live Coding with Jesse,q4hqFqOuDwk,"{'viewCount': '11429', 'likeCount': '243', 'favoriteCount': '0', 'commentCount': '4'}"
How to Code Like a Pro (with Dylan Israel),ZihKWQXRBmE,"{'viewCount': '139009', 'likeCount': '3217', 'favoriteCount': '0', 'commentCount': '98'}"
React Native Web UI Building  (P7D3) - Live Coding with Jesse,XCy7tFtl7io,"{'viewCount': '10936', 'likeCount': '197', 'favoriteCount': '0', 'commentCount': '12'}"
Intro to Data Science - Crash Course for Beginners,N6BghzuFLIg,"{'viewCount': '392773', 'likeCount': '8234', 'favoriteCount': '0', 'commentCount': '147'}"
React Native Web Setup Part 2 (P7D2) - Live Coding with Jesse,-94GMZhq5B4,"{'viewCount': '13565', 'likeCount': '254', 'favoriteCount': '0', 'commentCount': '16'}"
Foundation CSS Framework Tutorial - Crash Course for Beginners,_drzb7j9Bg4,"{'viewCount': '69087', 'likeCount': '969', 'favoriteCount': '0', 'commentCount': '28'}"
Unity 3D Tutorial - Beat Em Up Fight Game,gcF66q-UPCs,"{'viewCount': '191759', 'likeCount': '3767', 'favoriteCount': '0', 'commentCount': '166'}"
MongoDB with Python Crash Course - Tutorial for Beginners,E-1xI85Zog8,"{'viewCount': '269486', 'likeCount': '4700', 'favoriteCount': '0', 'commentCount': '87'}"
Python Algorithms for Interviews,p65AHm9MX80,"{'viewCount': '788228', 'likeCount': '14931', 'favoriteCount': '0', 'commentCount': '410'}"
Valve developers discuss Portal problems  - CS50's Intro to Game Development,riijspB9DIQ,"{'viewCount': '44242', 'likeCount': '1449', 'favoriteCount': '0', 'commentCount': '72'}"
Express.js & Node.js Course for Beginners - Full Tutorial,G8uL0lFFoN0,"{'viewCount': '273486', 'likeCount': '3948', 'favoriteCount': '0', 'commentCount': '184'}"
Portal Clone Tutorial in Unity - CS50's Intro to Game Development,359zcpybgIM,"{'viewCount': '28630', 'likeCount': '487', 'favoriteCount': '0', 'commentCount': '11'}"
Dreadhalls | Unity 3D Tutorial - CS50's Intro to Game Development,MOqpJp5ZyDE,"{'viewCount': '13134', 'likeCount': '231', 'favoriteCount': '0', 'commentCount': '6'}"
Unity / C# Tutorial | Helicopter Game 3D - CS50's Intro to Game Development,smRX1XItAjU,"{'viewCount': '40392', 'likeCount': '798', 'favoriteCount': '0', 'commentCount': '27'}"
Pokémon Coding Tutorial - CS50's Intro to Game Development,gx_qorHxBpI,"{'viewCount': '1029491', 'likeCount': '18921', 'favoriteCount': '0', 'commentCount': '341'}"
Angry Birds Coding Tutorial - CS50's Intro to Game Development,9iYjOkRDzBs,"{'viewCount': '33998', 'likeCount': '507', 'favoriteCount': '0', 'commentCount': '23'}"
Legend of Zelda Coding Tutorial - CS50's Intro to Game Development,SPAffu3ivIM,"{'viewCount': '41185', 'likeCount': '886', 'favoriteCount': '0', 'commentCount': '29'}"
Super Mario Bros Programming Tutorial - CS50's Intro to Game Development,_cPwFo--1LA,"{'viewCount': '98868', 'likeCount': '1491', 'favoriteCount': '0', 'commentCount': '52'}"
Match 3 (Lua Tutorial) - CS50's Intro to Game Development,64TbMmCgRv0,"{'viewCount': '18191', 'likeCount': '268', 'favoriteCount': '0', 'commentCount': '11'}"
Breakout (Lua Tutorial) - CS50's Intro to Game Development,pGpn2YMXtdg,"{'viewCount': '20872', 'likeCount': '387', 'favoriteCount': '0', 'commentCount': '29'}"
Flappy Bird (with Lua) - CS50's Intro to Game Development,rBHusPevM5k,"{'viewCount': '52950', 'likeCount': '869', 'favoriteCount': '0', 'commentCount': '48'}"
Applied Deep Learning with PyTorch - Full Course,CNuI8OWsppg,"{'viewCount': '152809', 'likeCount': '3080', 'favoriteCount': '0', 'commentCount': '107'}"
Pong (with Lua) - CS50's Intro to Game Development,jZqYXSmgDuM,"{'viewCount': '152810', 'likeCount': '2239', 'favoriteCount': '0', 'commentCount': '96'}"
SQL - Intro to Computer Science - Harvard's CS50 (2018),TplT4qjz1RQ,"{'viewCount': '183607', 'likeCount': '4171', 'favoriteCount': '0', 'commentCount': '97'}"
Tableau for Data Science and Data Visualization - Crash Course Tutorial,TPMlZxRRaBQ,"{'viewCount': '787463', 'likeCount': '11758', 'favoriteCount': '0', 'commentCount': '214'}"
Web Programming with Flask - Intro to Computer Science - Harvard's CS50 (2018),zdgYw-3tzfI,"{'viewCount': '300395', 'likeCount': '6784', 'favoriteCount': '0', 'commentCount': '152'}"
Python - Intro to Computer Science - Harvard's CS50 (2018),hnDU1G9hWqU,"{'viewCount': '444512', 'likeCount': '9307', 'favoriteCount': '0', 'commentCount': '262'}"
"HTTP, HTML, CSS - Intro to Computer Science - Harvard's CS50 (2018)",mudOTSUumXg,"{'viewCount': '165351', 'likeCount': '4136', 'favoriteCount': '0', 'commentCount': '102'}"
Data Structures - Intro to Computer Science - Harvard's CS50 (2018),uTZFGXv798o,"{'viewCount': '132111', 'likeCount': '2484', 'favoriteCount': '0', 'commentCount': '61'}"
Memory - Intro to Computer Science - Harvard's CS50 (2018),pejxLkT-wek,"{'viewCount': '140628', 'likeCount': '2778', 'favoriteCount': '0', 'commentCount': '86'}"
Arrays and Sorting Algorithms - Intro to Computer Science - Harvard's CS50 (2018),ba7e4mksR5I,"{'viewCount': '200765', 'likeCount': '3843', 'favoriteCount': '0', 'commentCount': '134'}"
C Programming Language - Intro to Computer Science - Harvard's CS50 (2018),ix5jPkxsr7M,"{'viewCount': '998785', 'likeCount': '23597', 'favoriteCount': '0', 'commentCount': '474'}"
React Tutorial: Weather App with RESTful APIs,cdBvSlVCOXw,"{'viewCount': '38705', 'likeCount': '622', 'favoriteCount': '0', 'commentCount': '26'}"
Computational Thinking & Scratch - Intro to Computer Science - Harvard's CS50 (2018),F0WoVEr0-44,"{'viewCount': '997880', 'likeCount': '14356', 'favoriteCount': '0', 'commentCount': '413'}"
Unity FPS Survival Game Tutorial - First Person Shooter Game Dev,Sqb-Ue7wpsI,"{'viewCount': '662917', 'likeCount': '14591', 'favoriteCount': '0', 'commentCount': '901'}"
React Native Web Setup (P7D1) - Live Coding with Jesse,T6e1GnlW8-g,"{'viewCount': '44004', 'likeCount': '384', 'favoriteCount': '0', 'commentCount': '23'}"
Create a Keylogger with Python - Tutorial,TbMKwl11itQ,"{'viewCount': '386215', 'likeCount': '8705', 'favoriteCount': '0', 'commentCount': '533'}"
Improve Cybersecurity Skills with CTFs - PicoCTF Walkthrough (2018),uIkxsBgkpj8,"{'viewCount': '255848', 'likeCount': '6021', 'favoriteCount': '0', 'commentCount': '133'}"
React Tutorial: Build an e-commerce site from scratch using React and Netlify,wPQ1-33teR4,"{'viewCount': '498049', 'likeCount': '8049', 'favoriteCount': '0', 'commentCount': '373'}"
Async/Await - JavaScript Tutorial,jAAmI5gMlVo,"{'viewCount': '53316', 'likeCount': '1295', 'favoriteCount': '0', 'commentCount': '44'}"
Swift Tutorial - Full Course for Beginners,comQ1-x2a1Q,"{'viewCount': '549304', 'likeCount': '8292', 'favoriteCount': '0', 'commentCount': '257'}"
Neural Networks with JavaScript - Full Course using Brain.js,6E6XecoTRVo,"{'viewCount': '120813', 'likeCount': '2730', 'favoriteCount': '0', 'commentCount': '84'}"
Beautiful Soup Tutorial - Web Scraping in Python,87Gx3U0BDlo,"{'viewCount': '305220', 'likeCount': '5753', 'favoriteCount': '0', 'commentCount': '228'}"
Web Developer Portfolio Review and Tips - Nisar,msrnbh66OhM,"{'viewCount': '15257', 'likeCount': '359', 'favoriteCount': '0', 'commentCount': '33'}"
Python Django Web Framework - Full Course for Beginners,F5mRW0jo-U4,"{'viewCount': '3861787', 'likeCount': '50252', 'favoriteCount': '0', 'commentCount': '1794'}"
How to make a 3d fight game in Unity - full tutorial,1wn5Ur1_vKg,"{'viewCount': '89522', 'likeCount': '1476', 'favoriteCount': '0', 'commentCount': '89'}"
MongoDB Tutorial - CRUD app from scratch using Node.js,CyTWPr_WwdI,"{'viewCount': '146636', 'likeCount': '2224', 'favoriteCount': '0', 'commentCount': '115'}"
CSS Full Course - Includes Flexbox and CSS Grid Tutorials,ieTHC78giGQ,"{'viewCount': '880271', 'likeCount': '17657', 'favoriteCount': '0', 'commentCount': '495'}"
Javascript Project Tutorial: Budget App,m_HJ3juuFvo,"{'viewCount': '214719', 'likeCount': '4273', 'favoriteCount': '0', 'commentCount': '135'}"
Python Game Tutorial: Pong,C6jJg9Zan7w,"{'viewCount': '492524', 'likeCount': '8494', 'favoriteCount': '0', 'commentCount': '1483'}"
Learn React JS - Full Course for Beginners - Tutorial 2019,DLX62G4lc44,"{'viewCount': '2997225', 'likeCount': '44641', 'favoriteCount': '0', 'commentCount': '2289'}"
Vue.js & Firebase Tutorial - Real-time Chat,ifOzAyR1cG4,"{'viewCount': '59355', 'likeCount': '824', 'favoriteCount': '0', 'commentCount': '44'}"
Weather App - Django Tutorial (Using Python Requests),qCQGV7F7CUc,"{'viewCount': '54029', 'likeCount': '983', 'favoriteCount': '0', 'commentCount': '39'}"
How I Landed My Dream Software Job in 12 Months,pmvxHOpms0g,"{'viewCount': '28695', 'likeCount': '655', 'favoriteCount': '0', 'commentCount': '32'}"
Ethical Hacking 101: Web App Penetration Testing - a full course for beginners,2_lswM1S264,"{'viewCount': '1732862', 'likeCount': '38839', 'favoriteCount': '0', 'commentCount': '579'}"
Unity Game Dev Full Tutorial: Infinite Runner,gE9bjYpUrNY,"{'viewCount': '46269', 'likeCount': '735', 'favoriteCount': '0', 'commentCount': '25'}"
Learn JavaScript - Full Course for Beginners,PkZNo7MFNFg,"{'viewCount': '15973507', 'likeCount': '245199', 'favoriteCount': '0', 'commentCount': '8324'}"
JavaScript Project Tutorial: Shopping Cart,q_TZhCWbS3I,"{'viewCount': '164358', 'likeCount': '2823', 'favoriteCount': '0', 'commentCount': '88'}"
How to Get Started in Web Development,XC2B_fE7S0g,"{'viewCount': '18179', 'likeCount': '546', 'favoriteCount': '0', 'commentCount': '19'}"
Interview Tips from a Senior Software Engineer... and a 4 year old,yrIvUFDPR0g,"{'viewCount': '15653', 'likeCount': '341', 'favoriteCount': '0', 'commentCount': '38'}"
Python and Pygame Tutorial - Build Tetris! Full GameDev Course,zfvxp7PgQ6c,"{'viewCount': '227324', 'likeCount': '3187', 'favoriteCount': '0', 'commentCount': '161'}"
Everyone is a Developer - Talk by Jessica Lord,6iZAl0jCHGc,"{'viewCount': '7888', 'likeCount': '188', 'favoriteCount': '0', 'commentCount': '13'}"
Learn Node.js - Full Tutorial for Beginners,RLtyhwFtXQA,"{'viewCount': '1061007', 'likeCount': '14086', 'favoriteCount': '0', 'commentCount': '498'}"
Learn JSON - Full Crash Course for Beginners,GpOO5iKzOmY,"{'viewCount': '152410', 'likeCount': '5261', 'favoriteCount': '0', 'commentCount': '163'}"
The All Powerful Front End Developer - Chris Coyier,vXJpOHz3_sY,"{'viewCount': '21489', 'likeCount': '634', 'favoriteCount': '0', 'commentCount': '20'}"
Native Android App Tutorial: WhatsApp Clone,988UZFB0heA,"{'viewCount': '580959', 'likeCount': '14212', 'favoriteCount': '0', 'commentCount': '375'}"
My Google Job Interview,bSuivEKegVk,"{'viewCount': '61907', 'likeCount': '1165', 'favoriteCount': '0', 'commentCount': '119'}"
Hacking Web Performance,UgSFxtIPc4c,"{'viewCount': '12947', 'likeCount': '361', 'favoriteCount': '0', 'commentCount': '8'}"
What do computer programmers actually do?,WvXsY736Kz0,"{'viewCount': '49727', 'likeCount': '1105', 'favoriteCount': '0', 'commentCount': '58'}"
Using a Public API - Tutorial for Beginners,BYsTrGH6B2s,"{'viewCount': '62302', 'likeCount': '1265', 'favoriteCount': '0', 'commentCount': '47'}"
Unity Game Dev Full Tutorial - 3D Snake Game,8ztq9fQT6Kc,"{'viewCount': '111458', 'likeCount': '1543', 'favoriteCount': '0', 'commentCount': '63'}"
Create a Platformer Game with JavaScript - Full Tutorial,w-OKdSHRlfA,"{'viewCount': '469735', 'likeCount': '8769', 'favoriteCount': '0', 'commentCount': '251'}"
React Beginners Tutorial - Build an Autocomplete Text Box,NnpISZANByg,"{'viewCount': '93452', 'likeCount': '1307', 'favoriteCount': '0', 'commentCount': '57'}"
7 Habits of Successful Software Engineers,6G_UQ0YepV8,"{'viewCount': '108312', 'likeCount': '3234', 'favoriteCount': '0', 'commentCount': '133'}"
npm Tutorial for Beginners,2V1UUhBJ62Y,"{'viewCount': '92456', 'likeCount': '1750', 'favoriteCount': '0', 'commentCount': '47'}"
Hackathon Live Demos from the 2018 freeCodeCamp JAMstack Hackathon top 7 teams,QhybHEs87mk,"{'viewCount': '17919', 'likeCount': '198', 'favoriteCount': '0', 'commentCount': '10'}"
"The History of Cryptography: Block Cyphers, Stream Cyphers, Public Keys and more!",-gJsYGjh4eQ,"{'viewCount': '7691', 'likeCount': '206', 'favoriteCount': '0', 'commentCount': '11'}"
Theory of Neural Networks - Deep Learning Without Frameworks,u7n9t1cBei8,"{'viewCount': '42018', 'likeCount': '1053', 'favoriteCount': '0', 'commentCount': '39'}"
How to Build a Discord Bot - Full JavaScript Chatbot Tutorial,8o25pRbXdFw,"{'viewCount': '117316', 'likeCount': '2482', 'favoriteCount': '0', 'commentCount': '332'}"
Learn TensorFlow.js - Deep Learning and Neural Networks with JavaScript,EoYfa6mYOG4,"{'viewCount': '179930', 'likeCount': '3609', 'favoriteCount': '0', 'commentCount': '106'}"
Resume Review: Front-end Web Developer (Waqar),kPQftUukf7A,"{'viewCount': '29565', 'likeCount': '330', 'favoriteCount': '0', 'commentCount': '18'}"
"Web Development Tutorial - JavaScript,  HTML, CSS - Rock Paper Scissors Game",jaVNP3nIAv0,"{'viewCount': '909181', 'likeCount': '21786', 'favoriteCount': '0', 'commentCount': '970'}"
Kubernetes: A Developer's Guide to Orchestrating Containers,hcHczN3wryw,"{'viewCount': '17583', 'likeCount': '304', 'favoriteCount': '0', 'commentCount': '6'}"
Computer Science Terminology,LtoBGQPuu1c,"{'viewCount': '169174', 'likeCount': '6360', 'favoriteCount': '0', 'commentCount': '149'}"
Beat Asteroids Game Using a Neural Network - JavaScript Tutorial,2cGHkBeGpeU,"{'viewCount': '26473', 'likeCount': '598', 'favoriteCount': '0', 'commentCount': '25'}"
Learn Angular - Full Tutorial Course,2OHbjep_WjQ,"{'viewCount': '737004', 'likeCount': '9383', 'favoriteCount': '0', 'commentCount': '253'}"
Writing Code like a Real Hacker (VS Code Macro Extension),rO8-cgtkZSw,"{'viewCount': '450567', 'likeCount': '8932', 'favoriteCount': '0', 'commentCount': '298'}"
Using icons on the web with Ionicons,WGsk13xh-Fk,"{'viewCount': '23567', 'likeCount': '369', 'favoriteCount': '0', 'commentCount': '25'}"
