Title,Video ID,Statistics
PostgreSQL Tutorial for Beginners,SpfIwlAYaKk,"{'viewCount': '20912', 'likeCount': '1041', 'favoriteCount': '0', 'commentCount': '48'}"
Bun Tutorial – JavaScript Runtime (Node.js Alternative) [Full Course],eTB0UCDnMQo,"{'viewCount': '23950', 'likeCount': '742', 'favoriteCount': '0', 'commentCount': '60'}"
"Build and Deploy Notion Clone – Full Stack Tutorial (NextJS 13, DALL•E, DrizzleORM, OpenAI, Vercel)",qDunJ0wVIec,"{'viewCount': '29497', 'likeCount': '958', 'favoriteCount': '0', 'commentCount': '33'}"
Prompt Engineering for Web Devs - ChatGPT and Bard Tutorial,ScKCy2udln8,"{'viewCount': '38064', 'likeCount': '1397', 'favoriteCount': '0', 'commentCount': '118'}"
The Ethics of AI & Machine Learning [Full Course],qpp1G0iEL_c,"{'viewCount': '27872', 'likeCount': '964', 'favoriteCount': '0', 'commentCount': '74'}"
"Next.js 13 E-Commerce Tutorial (App Router, TypeScript, Deployment, TailwindCSS, Prisma, DaisyUI)",K4ziF0MhbLc,"{'viewCount': '50069', 'likeCount': '1679', 'favoriteCount': '0', 'commentCount': '81'}"
VS Code Tutorial – Become More Productive,heXQnM99oAI,"{'viewCount': '119342', 'likeCount': '4267', 'favoriteCount': '0', 'commentCount': '183'}"
SvelteKit & TailwindCSS Tutorial – Build & Deploy a Web Portfolio,-2UjwQzxvBQ,"{'viewCount': '24877', 'likeCount': '748', 'favoriteCount': '0', 'commentCount': '27'}"
API Security for PCI Compliance (Data Security Standard),dlK7jec2rXo,"{'viewCount': '23702', 'likeCount': '813', 'favoriteCount': '0', 'commentCount': '22'}"
Astro Web Framework Crash Course,e-hTm5VmofI,"{'viewCount': '26721', 'likeCount': '738', 'favoriteCount': '0', 'commentCount': '59'}"
LangChain Crash Course for Beginners,lG7Uxts9SXs,"{'viewCount': '48201', 'likeCount': '1195', 'favoriteCount': '0', 'commentCount': '51'}"
Java Basics – Crash Course,GdzRzWymT4c,"{'viewCount': '45983', 'likeCount': '1837', 'favoriteCount': '0', 'commentCount': '103'}"
Nuxt 3 — Course for Beginners,fTPCKnZZ2dk,"{'viewCount': '24712', 'likeCount': '730', 'favoriteCount': '0', 'commentCount': '38'}"
Dynamic Programming – 0/1 Knapsack Problem Tutorial,hagBB17_hvg,"{'viewCount': '23446', 'likeCount': '700', 'favoriteCount': '0', 'commentCount': '39'}"
Rust Project Tutorial – Authentication Server Using Warp + JWT,6oMoHZZeyb0,"{'viewCount': '27317', 'likeCount': '635', 'favoriteCount': '0', 'commentCount': '23'}"
Mojo Programming Language – Full Course for Beginners,5Sm9IVMet9c,"{'viewCount': '95256', 'likeCount': '2890', 'favoriteCount': '0', 'commentCount': '197'}"
"Build SEO Optimized Blog with Next.js, Tailwind CSS & Contentlayer – Full Tutorial",nkGjob3q2GI,"{'viewCount': '40894', 'likeCount': '1389', 'favoriteCount': '0', 'commentCount': '51'}"
Python Tutorial for Beginners (with mini-projects),qwAFL1597eM,"{'viewCount': '132102', 'likeCount': '4960', 'favoriteCount': '0', 'commentCount': '166'}"
"Build & Deploy AI SaaS with Reoccurring Revenue (Next.js, OpenAI, Stripe, Tailwind, Vercel)",r895rFUbGtE,"{'viewCount': '79854', 'likeCount': '2822', 'favoriteCount': '0', 'commentCount': '171'}"
Vector Embeddings Tutorial – Code Your Own AI Assistant with GPT-4 API + LangChain + NLP,yfHHvmaMkcA,"{'viewCount': '74457', 'likeCount': '1675', 'favoriteCount': '0', 'commentCount': '82'}"
Fundamentals of Finance & Economics for Businesses – Crash Course,EJHPltmAULA,"{'viewCount': '160645', 'likeCount': '7874', 'favoriteCount': '0', 'commentCount': '191'}"
2D Wave Defense Game – GDevelop GameDev Tutorial,Uh5LhXAIyCw,"{'viewCount': '30731', 'likeCount': '903', 'favoriteCount': '0', 'commentCount': '68'}"
Dynamic Programming with Java – Learn to Solve Algorithmic Problems & Coding Challenges,oFkDldu3C_4,"{'viewCount': '58529', 'likeCount': '2124', 'favoriteCount': '0', 'commentCount': '75'}"
"YouTube Clone – T3 Stack Tutorial (Next.js, TypeScript, Tailwind CSS)",TV6tFPfz0go,"{'viewCount': '38867', 'likeCount': '1263', 'favoriteCount': '0', 'commentCount': '75'}"
"Full Stack Next.js, Typescript, Firebase Tutorial – Google Drive Clone",gwOVynGnDZA,"{'viewCount': '50830', 'likeCount': '1600', 'favoriteCount': '0', 'commentCount': '95'}"
Prompt Engineering Tutorial – Master ChatGPT and LLM Responses,_ZvnD73m40o,"{'viewCount': '425514', 'likeCount': '14857', 'favoriteCount': '0', 'commentCount': '420'}"
JavaScript Modules Crash Course,KeBxopnhizw,"{'viewCount': '30192', 'likeCount': '1163', 'favoriteCount': '0', 'commentCount': '50'}"
GraphQL Course for Beginners,5199E50O7SI,"{'viewCount': '64789', 'likeCount': '1969', 'favoriteCount': '0', 'commentCount': '69'}"
MERN Stack Tutorial - Book Store Project,-42K44A1oMA,"{'viewCount': '105012', 'likeCount': '3277', 'favoriteCount': '0', 'commentCount': '180'}"
OWASP API Security Top 10 Course – Secure Your Web Apps,YYe0FdfdgDU,"{'viewCount': '34400', 'likeCount': '1257', 'favoriteCount': '0', 'commentCount': '20'}"
Machine Learning & Neural Networks without Libraries – No Black Box Course,3wwiOSxDAmg,"{'viewCount': '88734', 'likeCount': '2744', 'favoriteCount': '0', 'commentCount': '91'}"
Free Foundational C# Certification from Microsoft – Full Course,6GQAE7iLOhY,"{'viewCount': '122480', 'likeCount': '4594', 'favoriteCount': '0', 'commentCount': '196'}"
Create a Large Language Model from Scratch with Python – Tutorial,UU1WVnMk4E8,"{'viewCount': '197713', 'likeCount': '6559', 'favoriteCount': '0', 'commentCount': '211'}"
SQL For Web Developers - Complete Database Course,KBDSJU3cGkc,"{'viewCount': '87253', 'likeCount': '3549', 'favoriteCount': '0', 'commentCount': '92'}"
Perl Programming Course for Beginners,_DFa26ep-h4,"{'viewCount': '29488', 'likeCount': '872', 'favoriteCount': '0', 'commentCount': '121'}"
Pong with Python & Pygame – Tutorial,tS8F7_X2qB0,"{'viewCount': '29249', 'likeCount': '868', 'favoriteCount': '0', 'commentCount': '31'}"
Code a Google Drive Clone using Laravel and Vue.js – Complete Course,Wn3IPX_ax-0,"{'viewCount': '48992', 'likeCount': '1875', 'favoriteCount': '0', 'commentCount': '78'}"
CSS to C Major 🎹 Tutorial,QKKvMx_7gdA,"{'viewCount': '35707', 'likeCount': '1552', 'favoriteCount': '0', 'commentCount': '10'}"
Best College Major,1m8NRrLLgkg,"{'viewCount': '38421', 'likeCount': '1422', 'favoriteCount': '0', 'commentCount': '89'}"
"Development with Large Language Models Tutorial – OpenAI, Langchain, Agents, Chroma",xZDB1naRUlk,"{'viewCount': '109145', 'likeCount': '2918', 'favoriteCount': '0', 'commentCount': '78'}"
HashiCorp Terraform Associate Certification Course (003) - Pass the Exam!,SPcwo0Gq9T8,"{'viewCount': '54357', 'likeCount': '1465', 'favoriteCount': '0', 'commentCount': '86'}"
WordPress Performance Fundamentals for Visitor Experience – Full Course,enb5kTJwV_s,"{'viewCount': '24955', 'likeCount': '910', 'favoriteCount': '0', 'commentCount': '26'}"
Stable Diffusion Crash Course for Beginners,dMkiOex_cKU,"{'viewCount': '80767', 'likeCount': '2800', 'favoriteCount': '0', 'commentCount': '198'}"
Python Power-Up: Leap Year,cE3YzKsQvEM,"{'viewCount': '60867', 'likeCount': '2577', 'favoriteCount': '0', 'commentCount': '44'}"
Is College Worth It in 2023?,N07nQ-uUsww,"{'viewCount': '42889', 'likeCount': '1458', 'favoriteCount': '0', 'commentCount': '261'}"
Harvard CS50’s Artificial Intelligence with Python – Full University Course,5NgNicANyqM,"{'viewCount': '813361', 'likeCount': '27969', 'favoriteCount': '0', 'commentCount': '489'}"
JavaScript Functions Crash Course,j1laALb8OVM,"{'viewCount': '64766', 'likeCount': '2318', 'favoriteCount': '0', 'commentCount': '81'}"
Calming Web Development – Colored Markers,ft-hs2a_zno,"{'viewCount': '31126', 'likeCount': '999', 'favoriteCount': '0', 'commentCount': '13'}"
Testing JavaScript with Cypress – Full Course,u8vMu7viCm8,"{'viewCount': '54676', 'likeCount': '1731', 'favoriteCount': '0', 'commentCount': '86'}"
JavaScript Tutorial – Celsius to Fahrenheit,kxyAk_K-wE4,"{'viewCount': '33292', 'likeCount': '1517', 'favoriteCount': '0', 'commentCount': '33'}"
TensorFlow Course – Building and Evaluating Medical AI Models,8m3LvPg8EuI,"{'viewCount': '38672', 'likeCount': '1343', 'favoriteCount': '0', 'commentCount': '46'}"
AI Safety – Full Course by Safe.AI Founder on Machine Learning & Ethics (Center for AI Safety),agEPmYdbQLs,"{'viewCount': '33434', 'likeCount': '1290', 'favoriteCount': '0', 'commentCount': '56'}"
Project-Based Augmented Reality Course with Unity Engine and AR Foundation,FJAO6jDYljs,"{'viewCount': '54659', 'likeCount': '1527', 'favoriteCount': '0', 'commentCount': '61'}"
Next.js & Appwrite – Full Stack Course for Beginners,ETV17M4SauU,"{'viewCount': '116884', 'likeCount': '3790', 'favoriteCount': '0', 'commentCount': '162'}"
Favicon in HTML,8M3YqhO3kVs,"{'viewCount': '73067', 'likeCount': '3549', 'favoriteCount': '0', 'commentCount': '29'}"
Full Stack Next.js & Supabase Twitter Clone – Full Course,QdxUZhLHZiA,"{'viewCount': '87791', 'likeCount': '2788', 'favoriteCount': '0', 'commentCount': '162'}"
Python Tkinter GUI Design Using ttkbootstrap - Complete Course,0tM-l_ZsxjU,"{'viewCount': '71762', 'likeCount': '1844', 'favoriteCount': '0', 'commentCount': '79'}"
Postman API Test Automation for Beginners,zp5Jh2FIpF0,"{'viewCount': '73938', 'likeCount': '2288', 'favoriteCount': '0', 'commentCount': '80'}"
Learn Terraform with Google Cloud Platform – Infrastructure as Code Course,VCayKl82Lt8,"{'viewCount': '32983', 'likeCount': '887', 'favoriteCount': '0', 'commentCount': '32'}"
Create a Programming Language and Learn Advanced Python – Full Course,1WpKsY9LBlY,"{'viewCount': '91238', 'likeCount': '3091', 'favoriteCount': '0', 'commentCount': '94'}"
Hot Dog or Not Hot Dog – Convolutional Neural Network Course for Beginners,nVhau51w6dM,"{'viewCount': '54590', 'likeCount': '1717', 'favoriteCount': '0', 'commentCount': '85'}"
Advanced C# Programming Course,YT8s-90oDC0,"{'viewCount': '258501', 'likeCount': '7583', 'favoriteCount': '0', 'commentCount': '178'}"
Pandas & Python for Data Analysis by Example – Full Course for Beginners,gtjxAH8uaP0,"{'viewCount': '148489', 'likeCount': '4193', 'favoriteCount': '0', 'commentCount': '127'}"
Learn Supabase (Firebase Alternative) – Full Tutorial for Beginners,dU7GwCOgvNY,"{'viewCount': '48084', 'likeCount': '1386', 'favoriteCount': '0', 'commentCount': '38'}"
Pointers in C for Absolute Beginners – Full Course,MIL2BK02X8A,"{'viewCount': '102351', 'likeCount': '3648', 'favoriteCount': '0', 'commentCount': '120'}"
Microsoft Power Platform Fundamentals (PL-900) — Full Course Pass the Exam!,ZTPcRWK0ytE,"{'viewCount': '78838', 'likeCount': '1726', 'favoriteCount': '0', 'commentCount': '79'}"
Learn Rust Programming - Complete Course 🦀,BpPEoZW5IiY,"{'viewCount': '256843', 'likeCount': '7597', 'favoriteCount': '0', 'commentCount': '291'}"
Deep Learning for Computer Vision with Python and TensorFlow – Complete Course,IA3WxTTPXqQ,"{'viewCount': '356952', 'likeCount': '11460', 'favoriteCount': '0', 'commentCount': '378'}"
Neo4j Course for Beginners,_IgbB24scLI,"{'viewCount': '51329', 'likeCount': '1235', 'favoriteCount': '0', 'commentCount': '57'}"
"Build AI Apps with ChatGPT, DALL-E, and GPT-4 – Full Course for Beginners",jlogLBkPZ2A,"{'viewCount': '125432', 'likeCount': '3942', 'favoriteCount': '0', 'commentCount': '115'}"
"Build and Deploy a LeetCode Clone with React, Next JS, TypeScript, Tailwind CSS, Firebase",GnodscC2p-A,"{'viewCount': '88526', 'likeCount': '2568', 'favoriteCount': '0', 'commentCount': '99'}"
Django ChatGPT Clone Tutorial,qrZGfBBlXpk,"{'viewCount': '60055', 'likeCount': '1718', 'favoriteCount': '0', 'commentCount': '75'}"
"Full-Stack Next.js, TypeScript, and AWS Course – Code a Quote Generator",FRmCxj9K7II,"{'viewCount': '78347', 'likeCount': '2504', 'favoriteCount': '0', 'commentCount': '71'}"
Use ChatGPT to Code a Full Stack App – Full Course,GizsSo-EevA,"{'viewCount': '194318', 'likeCount': '5484', 'favoriteCount': '0', 'commentCount': '184'}"
JavaScript Security Vulnerabilities Tutorial  – With Code Examples,ypNKKYUJE5o,"{'viewCount': '55990', 'likeCount': '2434', 'favoriteCount': '0', 'commentCount': '66'}"
Ionic & Capacitor for Building Native Mobile Apps – Full Course for Beginners,K7ghUiXLef8,"{'viewCount': '48376', 'likeCount': '1199', 'favoriteCount': '0', 'commentCount': '72'}"
Go Programming – Golang Course with Bonus Projects,un6ZyFkqFKo,"{'viewCount': '329752', 'likeCount': '7844', 'favoriteCount': '0', 'commentCount': '247'}"
Functional Programming with Elixir – Full Course,IiIgm_yaoOA,"{'viewCount': '54440', 'likeCount': '1328', 'favoriteCount': '0', 'commentCount': '86'}"
SQL Tutorial for Beginners (and Technical Interview Questions Solved),-fW2X7fh7Yg,"{'viewCount': '172660', 'likeCount': '5107', 'favoriteCount': '0', 'commentCount': '112'}"
.NET MAUI Course for Beginners – Create Cross-Platform Apps with C#,n3tA3Ku65_8,"{'viewCount': '75947', 'likeCount': '1696', 'favoriteCount': '0', 'commentCount': '64'}"
Machine Learning Foundations Course – Regression Analysis,2IZKK3pJQjg,"{'viewCount': '117416', 'likeCount': '4307', 'favoriteCount': '0', 'commentCount': '93'}"
Harvard CS50’s Introduction to Programming with Python – Full University Course,nLRL_NcnK-4,"{'viewCount': '2259186', 'likeCount': '76032', 'favoriteCount': '0', 'commentCount': '1196'}"
Scrapy Course – Python Web Scraping for Beginners,mBoX_JCKZTE,"{'viewCount': '227471', 'likeCount': '6022', 'favoriteCount': '0', 'commentCount': '245'}"
"Build a Simple Website with HTML, CSS, JavaScript – Course for Beginners",krfUjg0S2uI,"{'viewCount': '322058', 'likeCount': '9852', 'favoriteCount': '0', 'commentCount': '287'}"
Zustand React State Management Course (Simple Redux Alternative),fZPgBnL2x-Q,"{'viewCount': '74913', 'likeCount': '1784', 'favoriteCount': '0', 'commentCount': '90'}"
React Router 6 – Full Course,nDGA3km5He4,"{'viewCount': '157460', 'likeCount': '4477', 'favoriteCount': '0', 'commentCount': '236'}"
"JavaScript Interview Prep: Functions, Closures, Currying",tbqVqP5ilzQ,"{'viewCount': '81360', 'likeCount': '2971', 'favoriteCount': '0', 'commentCount': '82'}"
ChatGPT Course – Use The OpenAI API to Code 5 Projects,uRQH2CFvedY,"{'viewCount': '727971', 'likeCount': '21633', 'favoriteCount': '0', 'commentCount': '520'}"
Godot Game Development – Crash Course for Beginners,S8lMTwSRoRg,"{'viewCount': '367398', 'likeCount': '10376', 'favoriteCount': '0', 'commentCount': '713'}"
No Black Box Machine Learning Course – Learn Without Libraries,vDDjtwQDw2k,"{'viewCount': '443139', 'likeCount': '6941', 'favoriteCount': '0', 'commentCount': '286'}"
Build a LinkedIn Clone with React and Firebase – Tutorial,HimR8Xtz17U,"{'viewCount': '106206', 'likeCount': '2919', 'favoriteCount': '0', 'commentCount': '125'}"
"Firebase Tutorial for Beginners – Build a Mobile App with HTML, CSS, JavaScript",UFD4SP91tSM,"{'viewCount': '134540', 'likeCount': '4991', 'favoriteCount': '0', 'commentCount': '248'}"
Bash Scripting Tutorial for Beginners,tK9Oc6AEnR4,"{'viewCount': '214844', 'likeCount': '6127', 'favoriteCount': '0', 'commentCount': '142'}"
React Native Course – Android and iOS App Development,obH0Po_RdWk,"{'viewCount': '239124', 'likeCount': '6077', 'favoriteCount': '0', 'commentCount': '192'}"
Advanced C# – LINQ Tutorial,5l2qA3Pc83M,"{'viewCount': '62546', 'likeCount': '1511', 'favoriteCount': '0', 'commentCount': '37'}"
"Personal Website Tutorial with Next.js 13, Sanity.io, TailwindCSS, and TypeScript",OcTPaUfay5I,"{'viewCount': '135337', 'likeCount': '3089', 'favoriteCount': '0', 'commentCount': '333'}"
"Frontend Web Development: In-Depth Project Tutorial (HTML, CSS, JavaScript, TypeScript, React)",MsnQ5uepIaE,"{'viewCount': '239230', 'likeCount': '7951', 'favoriteCount': '0', 'commentCount': '136'}"
Learn Minimal APIs in .NET 7,lFo3Yy8Ro7w,"{'viewCount': '46359', 'likeCount': '1112', 'favoriteCount': '0', 'commentCount': '41'}"
Use ChatGPT to Build a RegEx Generator – OpenAI API Low Code Course,D6Xj_W4leu8,"{'viewCount': '101318', 'likeCount': '2130', 'favoriteCount': '0', 'commentCount': '83'}"
Software Engineering Job Interview – Full Mock Interview,1qw5ITr3k9E,"{'viewCount': '769498', 'likeCount': '19601', 'favoriteCount': '0', 'commentCount': '658'}"
Flutter App Development Course – Build a Twitter Clone with Appwrite and Riverpod,njLEDvoDjtk,"{'viewCount': '112740', 'likeCount': '3340', 'favoriteCount': '0', 'commentCount': '162'}"
React 3D Animation Website Tutorial with ThreeJS (WebGi) & GSAP,IyBhFma4H1A,"{'viewCount': '143553', 'likeCount': '5450', 'favoriteCount': '0', 'commentCount': '95'}"
Learn Vite – Frontend Build Tool Course,VAeRhmpcWEQ,"{'viewCount': '114825', 'likeCount': '2607', 'favoriteCount': '0', 'commentCount': '138'}"
Django Project – Code a CRM App Tutorial,t10QcFx7d5k,"{'viewCount': '227012', 'likeCount': '4900', 'favoriteCount': '0', 'commentCount': '135'}"
Python Reinforcement Learning using Gymnasium – Full Course,vufTSJbzKGU,"{'viewCount': '60130', 'likeCount': '1448', 'favoriteCount': '0', 'commentCount': '74'}"
Python Platformer Game Tutorial for Beginners,6gLeplbqtqg,"{'viewCount': '113809', 'likeCount': '3520', 'favoriteCount': '0', 'commentCount': '102'}"
SQL Database App with Windows GUI – Project Tutorial,VX4wl7qIcbA,"{'viewCount': '80616', 'likeCount': '2167', 'favoriteCount': '0', 'commentCount': '44'}"
Learn React 18 with Redux Toolkit – Full Tutorial for Beginners,2-crBg6wpp0,"{'viewCount': '447073', 'likeCount': '10279', 'favoriteCount': '0', 'commentCount': '377'}"
What is Python used for?,VrSJhTGMM90,"{'viewCount': '149373', 'likeCount': '7072', 'favoriteCount': '0', 'commentCount': '100'}"
Data Science Job Interview – Full Mock Interview,sD468LfeVdc,"{'viewCount': '309029', 'likeCount': '8664', 'favoriteCount': '0', 'commentCount': '265'}"
Harvard CS50’s Web Programming with Python and JavaScript – Full University Course,vzGllw18DkA,"{'viewCount': '724372', 'likeCount': '26633', 'favoriteCount': '0', 'commentCount': '440'}"
A Day in the Life of freeCodeCamp U.S. Staff (A rare in-person meeting),SIj4pzF0uk8,"{'viewCount': '243419', 'likeCount': '12355', 'favoriteCount': '0', 'commentCount': '254'}"
LaTeX – Full Tutorial for Beginners,ydOTMQC7np0,"{'viewCount': '306584', 'likeCount': '7141', 'favoriteCount': '0', 'commentCount': '235'}"
Why Node and React?,YY2ZhUQZyE4,"{'viewCount': '103630', 'likeCount': '5115', 'favoriteCount': '0', 'commentCount': '107'}"
AlphaZero from Scratch – Machine Learning Tutorial,wuSQpLinRB4,"{'viewCount': '100317', 'likeCount': '3259', 'favoriteCount': '0', 'commentCount': '168'}"
Enjoy Your Hard Drives! – Computer Basics #Shorts,OGHE5LlAmq0,"{'viewCount': '37855', 'likeCount': '1564', 'favoriteCount': '0', 'commentCount': '36'}"
Introduction to Linux – Full Course for Beginners,sWbUDq4S6Y8,"{'viewCount': '794399', 'likeCount': '21774', 'favoriteCount': '0', 'commentCount': '392'}"
HTML & Coding Introduction – Course for Beginners,GDGejH3SDNQ,"{'viewCount': '126146', 'likeCount': '3710', 'favoriteCount': '0', 'commentCount': '128'}"
Web Development with Python Tutorial – Flask & Dynamic Database-Driven Web Apps,yBDHkveJUf4,"{'viewCount': '218239', 'likeCount': '4721', 'favoriteCount': '0', 'commentCount': '295'}"
JavaScript GameDev Tutorial – Code an Animated Physics Game [Full Course],U34l-Xz5ynU,"{'viewCount': '165336', 'likeCount': '5860', 'favoriteCount': '0', 'commentCount': '160'}"
How do loops work in Python?,WYLjcXpxFOQ,"{'viewCount': '66190', 'likeCount': '3204', 'favoriteCount': '0', 'commentCount': '20'}"
3 Ways to Code a BuzzFeed Clone (JavaScript + TypeScript + JSONServer + Database + API + Node.js),qkQr42DmaEE,"{'viewCount': '58198', 'likeCount': '1327', 'favoriteCount': '0', 'commentCount': '71'}"
Can I ask you a question?,dw9YfaZR9Dc,"{'viewCount': '39220', 'likeCount': '854', 'favoriteCount': '0', 'commentCount': '19'}"
APIs for Beginners 2023 - How to use an API (Full Course / Tutorial),WXsD0ZgxjRw,"{'viewCount': '1022140', 'likeCount': '22490', 'favoriteCount': '0', 'commentCount': '508'}"
Passwords in HTML #shorts,1hG0i9dQXeg,"{'viewCount': '50652', 'likeCount': '2988', 'favoriteCount': '0', 'commentCount': '29'}"
Computer & Technology Basics Course for Absolute Beginners,y2kg3MOk1sY,"{'viewCount': '1711103', 'likeCount': '35708', 'favoriteCount': '0', 'commentCount': '476'}"
Learn Django by Building an Online Marketplace – Python Tutorial for Beginners,ZxMB6Njs3ck,"{'viewCount': '255602', 'likeCount': '5460', 'favoriteCount': '0', 'commentCount': '277'}"
How to Use Google Fonts #shorts,8ubmqUL3KR8,"{'viewCount': '47021', 'likeCount': '2358', 'favoriteCount': '0', 'commentCount': '29'}"
Full HTTP Networking Course – Fetch and REST APIs in JavaScript,2JYT5f2isg4,"{'viewCount': '595291', 'likeCount': '21680', 'favoriteCount': '0', 'commentCount': '308'}"
Using map() in Python #shorts,9FwhRztQNLg,"{'viewCount': '59492', 'likeCount': '3102', 'favoriteCount': '0', 'commentCount': '41'}"
Chrome Dinosaur Game Tricks #shorts,DIJN32qPS6Y,"{'viewCount': '52508', 'likeCount': '1512', 'favoriteCount': '0', 'commentCount': '16'}"
"Code a Reddit Clone with React, Next.js, Firebase v9, Chakra UI – Full Course",rCm5RVYKWVg,"{'viewCount': '128345', 'likeCount': '3664', 'favoriteCount': '0', 'commentCount': '205'}"
Webhooks Explained with a Roadtrip #shorts,8IOHjh3VQMU,"{'viewCount': '31176', 'likeCount': '1169', 'favoriteCount': '0', 'commentCount': '8'}"
College Algebra – Full Course with Python Code,i7vOAcUo5iA,"{'viewCount': '472722', 'likeCount': '15369', 'favoriteCount': '0', 'commentCount': '313'}"
PagerDuty Clone #shorts,GsYhWOC9-L8,"{'viewCount': '42467', 'likeCount': '1551', 'favoriteCount': '0', 'commentCount': '16'}"
"Full Stack Development with Java Spring Boot, React, and MongoDB – Full Course",5PdEmeopJVQ,"{'viewCount': '561893', 'likeCount': '14605', 'favoriteCount': '0', 'commentCount': '997'}"
ChatGPT Clone – OpenAI API and React Tutorial,98bGwOYoEGg,"{'viewCount': '138898', 'likeCount': '3803', 'favoriteCount': '0', 'commentCount': '162'}"
Learn Tailwind CSS – Course for Beginners,ft30zcMlFao,"{'viewCount': '284015', 'likeCount': '7109', 'favoriteCount': '0', 'commentCount': '308'}"
System Design for Beginners Course,m8Icp_Cid5o,"{'viewCount': '738028', 'likeCount': '23142', 'favoriteCount': '0', 'commentCount': '252'}"
Unreal Engine 5 – Full Course for Beginners,6UlU_FsicK8,"{'viewCount': '898928', 'likeCount': '28333', 'favoriteCount': '0', 'commentCount': '620'}"
Google Like a Pro – All Advanced Search Operators Tutorial [2023 Tips],BRiNw490Eq0,"{'viewCount': '282292', 'likeCount': '12196', 'favoriteCount': '0', 'commentCount': '325'}"
Music Production with FL Studio – Full Tutorial for Beginners,BUjdnxgBgzM,"{'viewCount': '400444', 'likeCount': '16173', 'favoriteCount': '0', 'commentCount': '582'}"
"Python for Web Development – Crash Course [API, SQL Databases, Virtual Environment, Flask, Django]",WNvxR8RFzBg,"{'viewCount': '91342', 'likeCount': '2831', 'favoriteCount': '0', 'commentCount': '81'}"
React with .NET Web API – Basic App Tutorial,4RKuyp_bOhY,"{'viewCount': '138225', 'likeCount': '2500', 'favoriteCount': '0', 'commentCount': '71'}"
Build Your Own SaaS - PagerDuty Clone. You'll Learn PostgreSQL + Stripe API + Twilio + SMTP,4xuBT3BbsYU,"{'viewCount': '121359', 'likeCount': '2625', 'favoriteCount': '0', 'commentCount': '104'}"
JavaScript Tutorial - Create a Card Game 🃏,Bj6lC93JMi0,"{'viewCount': '115985', 'likeCount': '3763', 'favoriteCount': '0', 'commentCount': '98'}"
Next.js React Framework Course – Build and Deploy a Full Stack App From scratch,KjY94sAKLlw,"{'viewCount': '534212', 'likeCount': '10879', 'favoriteCount': '0', 'commentCount': '397'}"
Swift Programming Tutorial – Full Course for Beginners,8Xg7E9shq0U,"{'viewCount': '183106', 'likeCount': '4590', 'favoriteCount': '0', 'commentCount': '119'}"
Learn Python GUI Development for Desktop – PySide6 and Qt Tutorial,Z1N9JzNax2k,"{'viewCount': '244950', 'likeCount': '5307', 'favoriteCount': '0', 'commentCount': '159'}"
MATLAB Crash Course for Beginners,7f50sQYjNRA,"{'viewCount': '310262', 'likeCount': '8318', 'favoriteCount': '0', 'commentCount': '178'}"
Django REST Framework Course – Build Web APIs with Python,tujhGdn1EMI,"{'viewCount': '165809', 'likeCount': '3831', 'favoriteCount': '0', 'commentCount': '186'}"
Python & PyGame Tutorial – Code a Duck Hunt Game,T2pd3KRSoHI,"{'viewCount': '76560', 'likeCount': '2026', 'favoriteCount': '0', 'commentCount': '68'}"
How to Make a WordPress Blog and Website – Tutorial for Beginners 2022,9VPq1JxMfkA,"{'viewCount': '87225', 'likeCount': '2581', 'favoriteCount': '0', 'commentCount': '115'}"
React State Management – Intermediate JavaScript Course,-bEzt5ISACA,"{'viewCount': '187135', 'likeCount': '5876', 'favoriteCount': '0', 'commentCount': '293'}"
Learn TypeScript – Full Tutorial,30LWjhZzg50,"{'viewCount': '616024', 'likeCount': '17443', 'favoriteCount': '0', 'commentCount': '609'}"
Command Line Hacking – Over The Wire Bandit Walkthrough (CTF Wargame),9ReSHQihuZw,"{'viewCount': '79659', 'likeCount': '2415', 'favoriteCount': '0', 'commentCount': '57'}"
Microservice Architecture and System Design with Python & Kubernetes – Full Course,hmkF77F9TLw,"{'viewCount': '285008', 'likeCount': '8181', 'favoriteCount': '0', 'commentCount': '285'}"
Microsoft 365 Fundamentals Certification (MS-900) — Full Course Pass the Exam!,Vw7KklJ8Lj8,"{'viewCount': '285985', 'likeCount': '5215', 'favoriteCount': '0', 'commentCount': '239'}"
"Full Stack Web Development for Beginners (Full Course on HTML, CSS, JavaScript, Node.js, MongoDB)",nu_pCVPKzTk,"{'viewCount': '1162923', 'likeCount': '33218', 'favoriteCount': '0', 'commentCount': '822'}"
Learn Kotlin Programming – Full Course for Beginners,EExSSotojVI,"{'viewCount': '413815', 'likeCount': '10282', 'favoriteCount': '0', 'commentCount': '332'}"
